{
  "$schema": "https://json-schema.org/draft/2020-12/schema",
  "$id": "https://offramp.dev/schemas/v1/workspace.json",
  "title": "Offramp workspace model",
  "description": ".offramp/workspace.json, written by `offramp scan`. See docs/spec/02-workspace-model.md.",
  "type": "object",
  "additionalProperties": false,
  "required": ["$schema", "version", "createdAt", "repositoryRoot", "solution", "source", "sdk", "projects", "graph", "packages", "inputs", "diagnostics"],
  "properties": {
    "$schema": { "const": "https://offramp.dev/schemas/v1/workspace.json" },
    "version": { "const": 1 },
    "createdAt": { "type": "string", "pattern": "^[0-9]{4}-[0-9]{2}-[0-9]{2}T[0-9]{2}:[0-9]{2}:[0-9]{2}Z$" },
    "repositoryRoot": { "type": "string" },
    "solution": { "type": ["string", "null"] },
    "source": { "$ref": "#/$defs/source" },
    "sdk": {
      "type": "object",
      "additionalProperties": false,
      "required": ["version", "os"],
      "properties": { "version": { "type": "string" }, "os": { "type": "string" } }
    },
    "projects": { "type": "array", "items": { "$ref": "#/$defs/project" } },
    "graph": { "$ref": "#/$defs/graph" },
    "packages": {
      "type": "object",
      "additionalProperties": {
        "type": "object",
        "additionalProperties": false,
        "required": ["versions"],
        "properties": {
          "versions": { "type": "object", "additionalProperties": { "$ref": "#/$defs/pathList" } }
        }
      }
    },
    "inputs": {
      "type": "array",
      "items": {
        "type": "object",
        "additionalProperties": false,
        "required": ["path", "sha256"],
        "properties": { "path": { "$ref": "#/$defs/relativePath" }, "sha256": { "$ref": "#/$defs/sha256" } }
      }
    },
    "diagnostics": { "type": "array", "items": { "$ref": "envelope.json#/$defs/diagnostic" } }
  },
  "$defs": {
    "relativePath": { "type": "string", "pattern": "^(?![A-Za-z]:)(?!/)[^\\\\]*$" },
    "pathList": { "type": "array", "items": { "$ref": "#/$defs/relativePath" } },
    "sha256": { "type": "string", "pattern": "^[0-9a-f]{64}$" },
    "source": {
      "type": "object",
      "additionalProperties": false,
      "required": ["kind", "path", "sha256", "complog"],
      "properties": {
        "kind": { "enum": ["binlog", "complog", "build"] },
        "path": { "type": "string" },
        "sha256": {
          "description": "The supplied log's SHA-256 (kind binlog or complog); null for a log Offramp built (kind build), which differs with every build of the same inputs.",
          "oneOf": [{ "type": "null" }, { "$ref": "#/$defs/sha256" }]
        },
        "complog": {
          "oneOf": [
            { "type": "null" },
            {
              "type": "object",
              "additionalProperties": false,
              "required": ["path", "sha256"],
              "properties": { "path": { "type": "string" }, "sha256": { "$ref": "#/$defs/sha256" } }
            }
          ]
        }
      }
    },
    "kind": { "enum": ["test", "web", "winforms", "wpf", "service", "console", "library", "unknown"] },
    "frameworkClass": { "enum": ["framework", "standard", "modern", "dual"] },
    "project": {
      "type": "object",
      "additionalProperties": false,
      "required": [
        "id", "name", "assemblyName", "rootNamespace", "language", "kind", "kindEvidence", "sdkStyle", "sdk", "targetFrameworks",
        "frameworkClass", "outputType", "isTestProject", "hostsTests", "properties", "defineConstants", "windowsOnlyBuildSteps", "packagesConfig",
        "compile", "compileExplicit", "projectReferences", "packageReferences", "assemblyReferences", "comReferences",
        "internalsVisibleTo", "resolved", "compilerCalls", "loc", "config"
      ],
      "properties": {
        "id": { "$ref": "#/$defs/relativePath" },
        "name": { "type": "string" },
        "assemblyName": { "type": ["string", "null"] },
        "rootNamespace": { "type": ["string", "null"] },
        "language": { "enum": ["csharp", "vb", "fsharp", "other"] },
        "kind": { "$ref": "#/$defs/kind" },
        "kindEvidence": { "type": ["string", "null"] },
        "hostedBy": {
          "description": "The web project whose application loads this one at run time: its output folder lies inside that project's folder, outside its own (docs/decisions/0055-hosted-projects-belong-to-their-host.md). Absent when none.",
          "type": "object",
          "additionalProperties": false,
          "required": ["project", "evidence"],
          "properties": {
            "project": { "$ref": "#/$defs/relativePath" },
            "evidence": { "type": "array", "items": { "type": "string" } }
          }
        },
        "sdkStyle": { "type": "boolean" },
        "sdk": { "type": ["string", "null"] },
        "targetFrameworks": { "type": "array", "items": { "type": "string" } },
        "frameworkClass": { "$ref": "#/$defs/frameworkClass" },
        "outputType": { "type": ["string", "null"] },
        "outputPath": { "$ref": "#/$defs/relativePath", "description": "The folder the build writes the assembly to (OutDir), repository-relative without a trailing slash, for the .NET Framework target when there is one; absent when outside the repository or unknown." },
        "isTestProject": { "type": "boolean" },
        "hostsTests": { "type": "boolean", "description": "True when a non-test-kind project references a test framework and carries tests." },
        "properties": { "type": "object", "additionalProperties": { "type": "string" } },
        "defineConstants": { "type": "object", "additionalProperties": { "type": "array", "items": { "type": "string" } } },
        "windowsOnlyBuildSteps": {
          "type": "array",
          "items": { "enum": ["sgen", "com", "entity-deploy", "t4", "fakes", "ssdt", "build-event", "web-targets", "aspnet-compiler", "path-case", "inline-task", "resources", "bcl-build", "mstest-v1", "web-site"] }
        },
        "packagesConfig": { "type": "boolean" },
        "packagesConfigPackages": {
          "description": "The packages the project's packages.config lists, sorted by id and version; absent without one.",
          "type": "array",
          "items": {
            "type": "object",
            "additionalProperties": false,
            "required": ["id", "version", "targetFramework", "developmentDependency"],
            "properties": {
              "id": { "type": "string" },
              "version": { "type": "string" },
              "targetFramework": { "type": ["string", "null"] },
              "developmentDependency": { "type": "boolean" }
            }
          }
        },
        "compile": { "$ref": "#/$defs/pathList" },
        "compileExplicit": { "type": "boolean" },
        "projectReferences": { "$ref": "#/$defs/pathList" },
        "modernProjectReferences": {
          "description": "Dual projects only: the project references their standard and modern targets use. Absent for other projects and in a model from a compiler log alone.",
          "$ref": "#/$defs/pathList"
        },
        "packageReferences": {
          "type": "array",
          "items": {
            "type": "object",
            "additionalProperties": false,
            "required": ["id", "version", "versionOverride", "privateAssets", "tfms"],
            "properties": {
              "id": { "type": "string" },
              "version": { "type": ["string", "null"] },
              "versionOverride": { "type": ["string", "null"] },
              "privateAssets": { "type": ["string", "null"] },
              "tfms": { "type": "array", "items": { "type": "string" } }
            }
          }
        },
        "assemblyReferences": {
          "type": "array",
          "items": {
            "type": "object",
            "additionalProperties": false,
            "required": ["name", "hintPath", "kind", "metadata"],
            "properties": {
              "name": { "type": "string" },
              "hintPath": { "type": ["string", "null"] },
              "kind": { "enum": ["framework", "file"] },
              "metadata": {
                "oneOf": [
                  { "type": "null" },
                  {
                    "type": "object",
                    "additionalProperties": false,
                    "required": ["assemblyVersion", "targetFramework", "publicKeyToken"],
                    "properties": {
                      "assemblyVersion": { "type": ["string", "null"] },
                      "targetFramework": { "type": ["string", "null"] },
                      "publicKeyToken": { "type": ["string", "null"] }
                    }
                  }
                ]
              }
            }
          }
        },
        "comReferences": {
          "type": "array",
          "items": {
            "type": "object",
            "additionalProperties": false,
            "required": ["name", "guid", "embedInteropTypes"],
            "properties": {
              "name": { "type": "string" },
              "guid": { "type": ["string", "null"] },
              "embedInteropTypes": { "type": "boolean" }
            }
          }
        },
        "internalsVisibleTo": { "type": "array", "items": { "type": "string" } },
        "resolved": {
          "type": "object",
          "additionalProperties": {
            "type": "object",
            "additionalProperties": false,
            "required": ["packages"],
            "properties": {
              "packages": {
                "type": "array",
                "items": {
                  "type": "object",
                  "additionalProperties": false,
                  "required": ["id", "version", "dependencies", "direct"],
                  "properties": {
                    "id": { "type": "string" },
                    "version": { "type": "string" },
                    "direct": { "type": "boolean" },
                    "dependencies": {
                      "type": "array",
                      "items": {
                        "type": "object",
                        "additionalProperties": false,
                        "required": ["id", "range"],
                        "properties": { "id": { "type": "string" }, "range": { "type": "string" } }
                      }
                    }
                  }
                }
              }
            }
          }
        },
        "compilerCalls": {
          "type": "object",
          "additionalProperties": {
            "type": "object",
            "additionalProperties": false,
            "required": ["complog", "project", "targetFramework"],
            "description": "Named by project and the target framework the compiler log records (null for a legacy project's call); readers find the call's position in the log.",
            "properties": {
              "complog": { "$ref": "#/$defs/relativePath" },
              "project": { "$ref": "#/$defs/relativePath" },
              "targetFramework": { "type": ["string", "null"] }
            }
          }
        },
        "loc": { "type": "integer", "minimum": 0 },
        "partial": { "const": true, "description": "Present only when some target frameworks have no compiler call, or their compiler call logged errors." },
        "config": {
          "type": "object",
          "additionalProperties": false,
          "required": ["kindOverride", "excluded"],
          "properties": {
            "kindOverride": { "oneOf": [{ "type": "null" }, { "$ref": "#/$defs/kind" }] },
            "excluded": { "type": "boolean" },
            "frozen": { "const": true }
          }
        }
      }
    },
    "graph": {
      "type": "object",
      "additionalProperties": false,
      "required": ["edges", "cycles", "topologicalOrder"],
      "properties": {
        "edges": {
          "type": "array",
          "items": {
            "type": "object",
            "additionalProperties": false,
            "required": ["from", "to", "kind"],
            "properties": {
              "from": { "$ref": "#/$defs/relativePath" },
              "to": { "$ref": "#/$defs/relativePath" },
              "kind": { "enum": ["project", "assembly"] }
            }
          }
        },
        "cycles": { "type": "array", "items": { "$ref": "#/$defs/pathList" } },
        "topologicalOrder": { "$ref": "#/$defs/pathList" }
      }
    }
  }
}
